{
  "schemaVersion": "1.0.0",
  "replaySessionId": "10000000-0000-4000-8000-000000000001",
  "machineId": "Mazak01",
  "sourceSetId": "nist-mazak01-20161005",
  "status": "RUNNING",
  "speedMultiplier": 10,
  "revision": 1,
  "sourceRange": {
    "startsAt": "2016-10-05T05:27:55.740706Z",
    "endsAt": "2016-10-05T19:15:07.025798Z"
  },
  "publicationCursor": {
    "replaySequence": 42,
    "sourceObservedAt": "2016-10-05T05:28:12.100000Z",
    "replayPublishedAt": "2026-09-04T00:00:01Z"
  }
}
